section_id,headline,artifact_anchor,coordination_note,result_label
phase4_synthetic_surface_gate,phase4_synthetic_surface_refresh is the synthetic surface artifact refresh entry gate,results/tables/cascade_benchmark_status.csv,Follows phase3 gold surface gate; timing-backed refresh not executed.,experimental/frontier
phase3_prerequisite,Phase3 gold surface refresh gate coordinated in prior wave,results/figures/cascade_benchmark_phase3_gate_coordination_card.md,phase3_gold_surface_refresh template_only; refresh not captured.,experimental/frontier
oppositeoverlap_boundary,OppositeOverlap diagnostic coordination precedes synthetic surface refresh gate,results/figures/speaker_profile_oppositeoverlap_diagnostic_coordination_card.md,All gold-case diagnostic boundaries documented; attribution still blocked.,experimental/frontier
wave13_boundary,Wave13 closure keeps phase4 gate separate from verified gold baseline CER,results/figures/wave13_exploration_baseline_closure_card.md,Coordination writeback only; no controlled benchmark session claimed.,experimental/frontier
timing_dependency,Synthetic surface refresh waits for phase2_synthetic_runtime_foundation timing evidence,results/tables/cascade_benchmark_manifest_template.csv,artifact_refresh_missing until controlled timing manifest is filled.,experimental/frontier
