section_id,headline,artifact_anchor,coordination_note,result_label
wave32_rollup,Wave32 closed: MidOverlap diagnostic refresh + demo + exploration closure,results/figures/wave32_exploration_baseline_closure_card.md,experimental/frontier coordination only; gold baseline untouched.,experimental/frontier
midoverlap_coordination,MidOverlap separation-harm diagnostic refresh coordinated after Wave32 closure,results/figures/wave32_speaker_profile_midoverlap_diagnostic_coordination_card.md,Diagnostic scope only; attribution claims still blocked.,experimental/frontier
demo_wave32,Demo presentation polish extended to 33 sections under qualitative/demo labeling,results/figures/demo_wave32_presentation_writeback.md,No live demo or benchmark timing claims.,qualitative/demo
frontier_board,Frontier go/no-go board remains all_ready after Wave32 chain,results/tables/frontier_go_no_go_summary.json,Coordination receipts only; no deployable routing claims.,experimental/frontier
wave33_boundary,External validation narrow slice refresh is the next open experimental coordination gate,results/tables/external_validation_status.json,Wave33 closure does not record external benchmark execution sessions.,external/sanity-check
