section_id,headline,artifact_anchor,coordination_note,result_label
heavyoverlap_diagnostic_scope,HeavyOverlap separation-benefit diagnostic scope refresh after Wave159 closure,results/figures/separation_phase_diagram.md,Separation helps ASR on this gold anchor; diagnostic-only — no attribution claim.,experimental/frontier
heavyoverlap_prior,Wave12 HeavyOverlap diagnostic coordination remains the prerequisite chain,results/figures/speaker_profile_heavyoverlap_diagnostic_coordination_card.md,Wave87 refresh does not replace original HeavyOverlap boundary documentation.,experimental/frontier
wave153_refresh,Wave153 HeavyOverlap diagnostic refresh precedes Wave159 refresh,results/figures/wave153_speaker_profile_heavyoverlap_diagnostic_coordination_card.md,Prior wave refresh provides chain for cyclic overlap diagnostic coordination.,experimental/frontier
midoverlap_refresh,Wave158 MidOverlap diagnostic refresh precedes HeavyOverlap refresh,results/figures/wave158_speaker_profile_midoverlap_diagnostic_coordination_card.md,Overlap diagnostic chain progresses MidOverlap → HeavyOverlap through coordinated refreshes.,experimental/frontier
wave159_boundary,Wave159 closure defers overlap embedding execution to diagnostic boundaries only,results/figures/wave159_exploration_baseline_closure_card.md,Gold baseline CER tables unchanged; attribution still blocked.,experimental/frontier
