section_id,headline,artifact_anchor,coordination_note,result_label
oppositeoverlap_diagnostic_scope,OppositeOverlap separation-benefit diagnostic scope refresh after Wave64 closure,results/figures/separation_phase_diagram.md,Separation helps ASR on this gold anchor; diagnostic-only — no attribution claim.,experimental/frontier
oppositeoverlap_prior,Wave13 OppositeOverlap diagnostic coordination remains the prerequisite chain,results/figures/speaker_profile_oppositeoverlap_diagnostic_coordination_card.md,Wave64 refresh does not replace original OppositeOverlap boundary documentation.,experimental/frontier
wave58_refresh,Wave58 OppositeOverlap diagnostic refresh precedes Wave64 refresh,results/figures/wave58_speaker_profile_oppositeoverlap_diagnostic_coordination_card.md,Prior wave refresh provides chain for cyclic overlap diagnostic coordination.,experimental/frontier
heavyoverlap_refresh,Wave63 HeavyOverlap diagnostic refresh precedes OppositeOverlap refresh,results/figures/wave63_speaker_profile_heavyoverlap_diagnostic_coordination_card.md,Overlap diagnostic chain completes with OppositeOverlap after separation-benefit cases.,experimental/frontier
wave64_boundary,Wave64 closure defers overlap embedding execution to diagnostic boundaries only,results/figures/wave64_exploration_baseline_closure_card.md,Gold baseline CER tables unchanged; attribution still blocked.,experimental/frontier
