section_id,headline,artifact_anchor,coordination_note,result_label
lightoverlap_diagnostic_scope,LightOverlap separation-harm diagnostic scope refresh after Wave21 closure,results/figures/separation_phase_diagram.md,Separation harms ASR on this gold anchor; diagnostic-only — no attribution claim.,experimental/frontier
lightoverlap_prior,Wave8 LightOverlap diagnostic coordination remains the prerequisite chain,results/figures/speaker_profile_lightoverlap_diagnostic_coordination_card.md,Wave21 refresh does not replace original LightOverlap boundary documentation.,experimental/frontier
wave16_refresh,Wave16 LightOverlap diagnostic refresh precedes Wave21 refresh,results/figures/wave16_speaker_profile_lightoverlap_diagnostic_coordination_card.md,Prior wave refresh provides chain for cyclic overlap diagnostic coordination.,experimental/frontier
wave21_boundary,Wave21 closure defers overlap embedding execution to diagnostic boundaries only,results/figures/wave21_exploration_baseline_closure_card.md,Gold baseline CER tables unchanged; attribution still blocked.,experimental/frontier
attribution_boundary,LightOverlap refresh does not upgrade diagnostic scope to attribution claims,results/figures/speaker_profile_go_no_go_summary.md,Controlled benchmark timing required before separation-benefit attribution.,experimental/frontier
