section_id,headline,artifact_anchor,coordination_note,result_label
wave16_rollup,Wave16 closed: LightOverlap diagnostic refresh + demo + exploration closure,results/figures/wave16_exploration_baseline_closure_card.md,experimental/frontier coordination only; gold baseline untouched.,experimental/frontier
lightoverlap_diagnostic,LightOverlap separation-harm diagnostic refresh coordinated after Wave16 closure,results/figures/wave16_speaker_profile_lightoverlap_diagnostic_coordination_card.md,Diagnostic scope only; attribution claims still blocked.,experimental/frontier
demo_wave16,Demo presentation polish extended to 17 sections under qualitative/demo labeling,results/figures/demo_wave16_presentation_writeback.md,No live demo or benchmark timing claims.,qualitative/demo
frontier_all_ready,Five-track frontier board remains 5/5 go,results/tables/frontier_go_no_go_summary.json,Coordination rollup; does not claim frontier execution completion.,experimental/frontier
wave17_boundary,Speaker profile MidOverlap diagnostic refresh is the next open experimental coordination gate,results/tables/speaker_profile_status.json,Wave17 closure does not record overlap-case embedding execution sessions.,experimental/frontier
