section_id,headline,artifact_anchor,coordination_note,result_label
wave25_rollup,Wave25 closed: external validation narrow slice refresh + demo + exploration closure,results/figures/wave25_exploration_baseline_closure_card.md,experimental/frontier coordination only; gold baseline untouched.,experimental/frontier
external_validation_coordination,External validation narrow slice refresh coordinated on AISHELL-4 stub boundary,results/figures/wave25_external_validation_narrow_slice_coordination_card.md,External/sanity-check scope only; gold benchmark claims still blocked.,external/sanity-check
demo_wave25,Demo presentation polish extended to 26 sections under qualitative/demo labeling,results/figures/demo_wave25_presentation_writeback.md,No live demo or benchmark timing claims.,qualitative/demo
frontier_board,Frontier go/no-go board remains all_ready after Wave25 chain,results/tables/frontier_go_no_go_summary.json,Coordination receipts only; no deployable routing claims.,experimental/frontier
wave26_boundary,MeetEval official cpWER narrow dry-run refresh is the next open experimental coordination gate,results/tables/meeteval_official_status.json,Wave26 closure does not record MeetEval official benchmark execution sessions.,experimental/frontier
