section_id,headline,artifact_anchor,coordination_note,result_label
oppositeoverlap_diagnostic_scope,OppositeOverlap separation-benefit diagnostic scope refresh after Wave52 closure,results/figures/separation_phase_diagram.md,Separation helps ASR on this gold anchor; diagnostic-only — no attribution claim.,experimental/frontier
oppositeoverlap_prior,Wave13 OppositeOverlap diagnostic coordination remains the prerequisite chain,results/figures/speaker_profile_oppositeoverlap_diagnostic_coordination_card.md,Wave52 refresh does not replace original OppositeOverlap boundary documentation.,experimental/frontier
wave46_refresh,Wave46 OppositeOverlap diagnostic refresh precedes Wave52 refresh,results/figures/wave46_speaker_profile_oppositeoverlap_diagnostic_coordination_card.md,Prior wave refresh provides chain for cyclic overlap diagnostic coordination.,experimental/frontier
heavyoverlap_refresh,Wave51 HeavyOverlap diagnostic refresh precedes OppositeOverlap refresh,results/figures/wave51_speaker_profile_heavyoverlap_diagnostic_coordination_card.md,Overlap diagnostic chain completes with OppositeOverlap after separation-benefit cases.,experimental/frontier
wave52_boundary,Wave52 closure defers overlap embedding execution to diagnostic boundaries only,results/figures/wave52_exploration_baseline_closure_card.md,Gold baseline CER tables unchanged; attribution still blocked.,experimental/frontier
