section_id,headline,artifact_anchor,coordination_note,result_label
official_dry_run,Official MeetEval cpWER narrow dry-run remains complete on 5/5 gold cases,results/tables/meeteval_cpwer_official_execution.json,experimental/frontier dry-run only; not a full external benchmark claim.,experimental/frontier
bridge_checklist,Official execution bridge checklist documents per-case handoff boundaries,results/tables/meeteval_cpwer_official_execution_bridge_checklist.json,Bridge checklist complete; official benchmark completion still blocked.,experimental/frontier
wave126_prior_coordination,Wave126 official MeetEval narrow dry-run refresh remains the prerequisite chain,results/figures/wave126_meeteval_official_narrow_dry_run_coordination_card.md,Wave126 refresh does not replace Wave120 official MeetEval boundary documentation.,experimental/frontier
character_level_refresh,Wave17 character-level MeetEval narrow dry-run refresh precedes official refresh,results/figures/wave17_meeteval_cpwer_narrow_dry_run_coordination_card.md,Character-level coordination provides prerequisite chain for official refresh.,experimental/frontier
wave132_boundary,Wave132 closure keeps official MeetEval coordination separate from gold baseline CER,results/figures/wave132_exploration_baseline_closure_card.md,Coordination writeback only; stable gold CER tables unchanged.,experimental/frontier
