section_id,headline,artifact_anchor,coordination_note,result_label
wave68_rollup,Wave68 closed: MidOverlap diagnostic refresh + demo + exploration closure,results/figures/wave68_exploration_baseline_closure_card.md,experimental/frontier coordination only; gold baseline untouched.,experimental/frontier
midoverlap_coordination,MidOverlap separation-harm diagnostic refresh coordinated after Wave68 closure,results/figures/wave68_speaker_profile_midoverlap_diagnostic_coordination_card.md,Diagnostic scope only; attribution claims still blocked.,experimental/frontier
demo_wave68,Demo presentation polish extended to 69 sections under qualitative/demo labeling,results/figures/demo_wave68_presentation_writeback.md,No live demo or benchmark timing claims.,qualitative/demo
frontier_board,Frontier go/no-go board remains all_ready after Wave68 chain,results/tables/frontier_go_no_go_summary.json,Coordination receipts only; no deployable routing claims.,experimental/frontier
wave69_boundary,HeavyOverlap speaker-profile diagnostic narrow slice refresh is the next open coordination gate,results/figures/separation_phase_diagram.md,Wave69 closure does not record overlap-case embedding execution sessions.,experimental/frontier
